{"$schema":"https://json-schema.org/draft/2020-12/schema","additionalProperties":false,"allOf":[{"if":{"properties":{"complete":{"const":true}}},"then":{"properties":{"closureComplete":{"const":true},"inputsVerified":{"const":true}}}},{"if":{"properties":{"closureComplete":{"const":true},"inputsVerified":{"const":true}}},"then":{"properties":{"complete":{"const":true}}}},{"if":{"properties":{"scanComplete":{"const":false}}},"then":{"properties":{"closureComplete":{"const":false},"inputsVerified":{"const":false},"resolutionComplete":{"const":false}}}},{"if":{"properties":{"mode":{"const":"audit"},"resolutionComplete":{"const":true}}},"then":{"properties":{"closureComplete":{"const":true}}}},{"if":{"properties":{"mode":{"const":"audit"},"resolutionComplete":{"const":false}}},"then":{"properties":{"closureComplete":{"const":false}}}}],"properties":{"addedFiles":{"items":{"maxLength":65536,"pattern":"^(?!\\.{1,2}(?:/|$))(?!/)(?!.*?/\\.{1,2}(?:/|$))(?!.*//)(?!.*?/$)[^\\\\:\\x00-\\x1f\\x7f]+$","type":"string"},"type":"array"},"blockers":{"items":{"additionalProperties":false,"properties":{"code":{"maxLength":128,"type":"string"},"evidence":{"additionalProperties":{"maxLength":1048576,"type":"string"},"maxProperties":64,"type":"object"},"message":{"maxLength":4096,"type":"string"},"record":{"additionalProperties":false,"properties":{"ordinal":{"maximum":9223372036854775807,"minimum":1,"type":"integer"},"path":{"maxLength":65536,"pattern":"^(?!\\.{1,2}(?:/|$))(?!/)(?!.*?/\\.{1,2}(?:/|$))(?!.*//)(?!.*?/$)[^\\\\:\\x00-\\x1f\\x7f]+$","type":"string"}},"required":["path","ordinal"],"type":["object","null"]}},"required":["code","record","message","evidence"],"type":"object"},"type":"array"},"choices":{"items":{"additionalProperties":false,"properties":{"consumer":{"additionalProperties":false,"properties":{"ordinal":{"maximum":9223372036854775807,"minimum":1,"type":"integer"},"path":{"maxLength":65536,"pattern":"^(?!\\.{1,2}(?:/|$))(?!/)(?!.*?/\\.{1,2}(?:/|$))(?!.*//)(?!.*?/$)[^\\\\:\\x00-\\x1f\\x7f]+$","type":"string"}},"required":["path","ordinal"],"type":"object"},"provider":{"additionalProperties":false,"properties":{"ordinal":{"maximum":9223372036854775807,"minimum":1,"type":"integer"},"path":{"maxLength":65536,"pattern":"^(?!\\.{1,2}(?:/|$))(?!/)(?!.*?/\\.{1,2}(?:/|$))(?!.*//)(?!.*?/$)[^\\\\:\\x00-\\x1f\\x7f]+$","type":"string"}},"required":["path","ordinal"],"type":"object"}},"required":["consumer","provider"],"type":"object"},"type":"array"},"closureComplete":{"type":"boolean"},"complete":{"type":"boolean"},"corpusFingerprint":{"maxLength":64,"pattern":"^[0-9a-f]{64}$","type":"string"},"files":{"items":{"additionalProperties":false,"properties":{"complete":{"type":"boolean"},"path":{"maxLength":65536,"pattern":"^(?!\\.{1,2}(?:/|$))(?!/)(?!.*?/\\.{1,2}(?:/|$))(?!.*//)(?!.*?/$)[^\\\\:\\x00-\\x1f\\x7f]+$","type":"string"},"recordCount":{"maximum":9223372036854775807,"minimum":0,"type":"integer"},"sha256":{"maxLength":64,"pattern":"^(?:[0-9a-f]{64})?$","type":"string"}},"required":["path","sha256","recordCount","complete"],"type":"object"},"type":"array"},"findings":{"items":{"additionalProperties":false,"properties":{"code":{"maxLength":128,"type":"string"},"evidence":{"additionalProperties":{"maxLength":1048576,"type":"string"},"maxProperties":64,"type":"object"},"message":{"maxLength":4096,"type":"string"},"record":{"additionalProperties":false,"properties":{"ordinal":{"maximum":9223372036854775807,"minimum":1,"type":"integer"},"path":{"maxLength":65536,"pattern":"^(?!\\.{1,2}(?:/|$))(?!/)(?!.*?/\\.{1,2}(?:/|$))(?!.*//)(?!.*?/$)[^\\\\:\\x00-\\x1f\\x7f]+$","type":"string"}},"required":["path","ordinal"],"type":["object","null"]}},"required":["code","record","message","evidence"],"type":"object"},"type":"array"},"includedFiles":{"items":{"maxLength":65536,"pattern":"^(?!\\.{1,2}(?:/|$))(?!/)(?!.*?/\\.{1,2}(?:/|$))(?!.*//)(?!.*?/$)[^\\\\:\\x00-\\x1f\\x7f]+$","type":"string"},"type":"array"},"inputsVerified":{"type":"boolean"},"limits":{"additionalProperties":false,"properties":{"maxBlockBytes":{"maximum":9223372036854775807,"minimum":1,"type":"integer"},"maxExpandedBytes":{"maximum":9223372036854775807,"minimum":1,"type":"integer"},"maxHeaderBytes":{"maximum":2147483647,"minimum":1,"type":"integer"},"maxRecords":{"maximum":9223372036854775807,"minimum":1,"type":"integer"},"maxScratchBytes":{"maximum":9223372036854775807,"minimum":1,"type":"integer"}},"required":["maxExpandedBytes","maxRecords","maxBlockBytes","maxHeaderBytes","maxScratchBytes"],"type":"object"},"mode":{"enum":["audit","plan"],"maxLength":256,"type":"string"},"records":{"items":{"additionalProperties":false,"properties":{"findings":{"items":{"additionalProperties":false,"properties":{"code":{"maxLength":128,"type":"string"},"evidence":{"additionalProperties":{"maxLength":1048576,"type":"string"},"maxProperties":64,"type":"object"},"message":{"maxLength":4096,"type":"string"},"record":{"additionalProperties":false,"properties":{"ordinal":{"maximum":9223372036854775807,"minimum":1,"type":"integer"},"path":{"maxLength":65536,"pattern":"^(?!\\.{1,2}(?:/|$))(?!/)(?!.*?/\\.{1,2}(?:/|$))(?!.*//)(?!.*?/$)[^\\\\:\\x00-\\x1f\\x7f]+$","type":"string"}},"required":["path","ordinal"],"type":["object","null"]}},"required":["code","record","message","evidence"],"type":"object"},"type":"array"},"key":{"additionalProperties":false,"properties":{"ordinal":{"maximum":9223372036854775807,"minimum":1,"type":"integer"},"path":{"maxLength":65536,"pattern":"^(?!\\.{1,2}(?:/|$))(?!/)(?!.*?/\\.{1,2}(?:/|$))(?!.*//)(?!.*?/$)[^\\\\:\\x00-\\x1f\\x7f]+$","type":"string"}},"required":["path","ordinal"],"type":"object"},"normalizedDigests":{"additionalProperties":false,"properties":{"block":{"additionalProperties":false,"allOf":[{"if":{"properties":{"algorithm":{"const":"sha1"}}},"then":{"properties":{"hex":{"pattern":"^[0-9a-f]{40}$"}}}},{"if":{"properties":{"algorithm":{"const":"sha256"}}},"then":{"properties":{"hex":{"pattern":"^[0-9a-f]{64}$"}}}}],"properties":{"algorithm":{"enum":["sha1","sha256"],"maxLength":256,"type":"string"},"hex":{"maxLength":64,"pattern":"^(?:[0-9a-f]{40}|[0-9a-f]{64})$","type":"string"}},"required":["algorithm","hex"],"type":["object","null"]},"payload":{"additionalProperties":false,"allOf":[{"if":{"properties":{"algorithm":{"const":"sha1"}}},"then":{"properties":{"hex":{"pattern":"^[0-9a-f]{40}$"}}}},{"if":{"properties":{"algorithm":{"const":"sha256"}}},"then":{"properties":{"hex":{"pattern":"^[0-9a-f]{64}$"}}}}],"properties":{"algorithm":{"enum":["sha1","sha256"],"maxLength":256,"type":"string"},"hex":{"maxLength":64,"pattern":"^(?:[0-9a-f]{40}|[0-9a-f]{64})$","type":"string"}},"required":["algorithm","hex"],"type":["object","null"]}},"required":["block","payload"],"type":"object"},"outcome":{"additionalProperties":false,"properties":{"immediateProvider":{"additionalProperties":false,"properties":{"ordinal":{"maximum":9223372036854775807,"minimum":1,"type":"integer"},"path":{"maxLength":65536,"pattern":"^(?!\\.{1,2}(?:/|$))(?!/)(?!.*?/\\.{1,2}(?:/|$))(?!.*//)(?!.*?/$)[^\\\\:\\x00-\\x1f\\x7f]+$","type":"string"}},"required":["path","ordinal"],"type":["object","null"]},"payloadEvidence":{"additionalProperties":false,"properties":{"complete":{"type":"boolean"},"hexDigests":{"additionalProperties":{"maxLength":64,"pattern":"^(?:[0-9a-f]{40}|[0-9a-f]{64})$","type":"string"},"maxProperties":2,"properties":{"sha1":{"pattern":"^[0-9a-f]{40}$"},"sha256":{"pattern":"^[0-9a-f]{64}$"}},"propertyNames":{"enum":["sha1","sha256"]},"type":"object"},"length":{"maximum":9223372036854775807,"minimum":0,"type":"integer"}},"required":["length","hexDigests","complete"],"type":["object","null"]},"selectionBasis":{"maxLength":128,"type":"string"},"status":{"enum":["resolved","missing_in_corpus","ambiguous","selector_conflict","digest_mismatch","unsupported","cycle","input_incomplete"],"maxLength":256,"type":"string"},"terminal":{"additionalProperties":false,"properties":{"ordinal":{"maximum":9223372036854775807,"minimum":1,"type":"integer"},"path":{"maxLength":65536,"pattern":"^(?!\\.{1,2}(?:/|$))(?!/)(?!.*?/\\.{1,2}(?:/|$))(?!.*//)(?!.*?/$)[^\\\\:\\x00-\\x1f\\x7f]+$","type":"string"}},"required":["path","ordinal"],"type":["object","null"]}},"required":["status","immediateProvider","selectionBasis","terminal","payloadEvidence"],"type":"object"},"payloadEvidence":{"additionalProperties":false,"properties":{"complete":{"type":"boolean"},"hexDigests":{"additionalProperties":{"maxLength":64,"pattern":"^(?:[0-9a-f]{40}|[0-9a-f]{64})$","type":"string"},"maxProperties":2,"properties":{"sha1":{"pattern":"^[0-9a-f]{40}$"},"sha256":{"pattern":"^[0-9a-f]{64}$"}},"propertyNames":{"enum":["sha1","sha256"]},"type":"object"},"length":{"maximum":9223372036854775807,"minimum":0,"type":"integer"}},"required":["length","hexDigests","complete"],"type":["object","null"]},"rawHeaders":{"additionalProperties":{"items":{"maxLength":1048576,"type":"string"},"type":"array"},"maxProperties":32,"type":"object"},"selector":{"additionalProperties":false,"properties":{"candidates":{"items":{"additionalProperties":false,"properties":{"ordinal":{"maximum":9223372036854775807,"minimum":1,"type":"integer"},"path":{"maxLength":65536,"pattern":"^(?!\\.{1,2}(?:/|$))(?!/)(?!.*?/\\.{1,2}(?:/|$))(?!.*//)(?!.*?/$)[^\\\\:\\x00-\\x1f\\x7f]+$","type":"string"}},"required":["path","ordinal"],"type":"object"},"type":"array"},"chosen":{"additionalProperties":false,"properties":{"ordinal":{"maximum":9223372036854775807,"minimum":1,"type":"integer"},"path":{"maxLength":65536,"pattern":"^(?!\\.{1,2}(?:/|$))(?!/)(?!.*?/\\.{1,2}(?:/|$))(?!.*//)(?!.*?/$)[^\\\\:\\x00-\\x1f\\x7f]+$","type":"string"}},"required":["path","ordinal"],"type":["object","null"]},"evidence":{"additionalProperties":{"maxLength":1048576,"type":"string"},"maxProperties":64,"type":"object"},"findings":{"items":{"additionalProperties":false,"properties":{"code":{"maxLength":128,"type":"string"},"evidence":{"additionalProperties":{"maxLength":1048576,"type":"string"},"maxProperties":64,"type":"object"},"message":{"maxLength":4096,"type":"string"},"record":{"additionalProperties":false,"properties":{"ordinal":{"maximum":9223372036854775807,"minimum":1,"type":"integer"},"path":{"maxLength":65536,"pattern":"^(?!\\.{1,2}(?:/|$))(?!/)(?!.*?/\\.{1,2}(?:/|$))(?!.*//)(?!.*?/$)[^\\\\:\\x00-\\x1f\\x7f]+$","type":"string"}},"required":["path","ordinal"],"type":["object","null"]}},"required":["code","record","message","evidence"],"type":"object"},"type":"array"},"selectionBasis":{"maxLength":128,"type":"string"},"status":{"enum":["resolved","missing_in_corpus","ambiguous","selector_conflict","digest_mismatch","unsupported","cycle","input_incomplete"],"maxLength":256,"type":"string"}},"required":["status","selectionBasis","chosen","evidence","candidates","findings"],"type":["object","null"]},"type":{"maxLength":1048576,"type":"string"},"version":{"enum":["WARC/1.0","WARC/1.1"],"maxLength":256,"type":"string"}},"required":["key","type","version","rawHeaders","normalizedDigests","payloadEvidence","selector","outcome","findings"],"type":"object"},"type":"array"},"resolutionComplete":{"type":"boolean"},"scanComplete":{"type":"boolean"},"schemaVersion":{"enum":[1],"maximum":9223372036854775807,"minimum":0,"type":"integer"},"supportProfile":{"enum":["revisitledger/identical-payload-v1"],"maxLength":256,"type":"string"},"toolVersion":{"enum":["0.1.0"],"maxLength":256,"type":"string"},"warnings":{"items":{"maxLength":4096,"type":"string"},"type":"array"},"witnessEdges":{"items":{"additionalProperties":false,"properties":{"consumer":{"additionalProperties":false,"properties":{"ordinal":{"maximum":9223372036854775807,"minimum":1,"type":"integer"},"path":{"maxLength":65536,"pattern":"^(?!\\.{1,2}(?:/|$))(?!/)(?!.*?/\\.{1,2}(?:/|$))(?!.*//)(?!.*?/$)[^\\\\:\\x00-\\x1f\\x7f]+$","type":"string"}},"required":["path","ordinal"],"type":"object"},"payloadEvidence":{"additionalProperties":false,"properties":{"complete":{"type":"boolean"},"hexDigests":{"additionalProperties":{"maxLength":64,"pattern":"^(?:[0-9a-f]{40}|[0-9a-f]{64})$","type":"string"},"maxProperties":2,"properties":{"sha1":{"pattern":"^[0-9a-f]{40}$"},"sha256":{"pattern":"^[0-9a-f]{64}$"}},"propertyNames":{"enum":["sha1","sha256"]},"type":"object"},"length":{"maximum":9223372036854775807,"minimum":0,"type":"integer"}},"required":["length","hexDigests","complete"],"type":"object"},"provider":{"additionalProperties":false,"properties":{"ordinal":{"maximum":9223372036854775807,"minimum":1,"type":"integer"},"path":{"maxLength":65536,"pattern":"^(?!\\.{1,2}(?:/|$))(?!/)(?!.*?/\\.{1,2}(?:/|$))(?!.*//)(?!.*?/$)[^\\\\:\\x00-\\x1f\\x7f]+$","type":"string"}},"required":["path","ordinal"],"type":"object"},"selectionBasis":{"maxLength":128,"type":"string"},"terminal":{"additionalProperties":false,"properties":{"ordinal":{"maximum":9223372036854775807,"minimum":1,"type":"integer"},"path":{"maxLength":65536,"pattern":"^(?!\\.{1,2}(?:/|$))(?!/)(?!.*?/\\.{1,2}(?:/|$))(?!.*//)(?!.*?/$)[^\\\\:\\x00-\\x1f\\x7f]+$","type":"string"}},"required":["path","ordinal"],"type":"object"}},"required":["consumer","provider","selectionBasis","terminal","payloadEvidence"],"type":"object"},"type":"array"}},"required":["schemaVersion","toolVersion","supportProfile","mode","limits","corpusFingerprint","scanComplete","resolutionComplete","closureComplete","inputsVerified","complete","files","records","choices","includedFiles","addedFiles","witnessEdges","blockers","findings","warnings"],"title":"RevisitLedger report v1","type":"object"}
