{"schemaVersion":1,"toolVersion":"0.1.0","supportProfile":"revisitledger/identical-payload-v1","mode":"plan","limits":{"maxExpandedBytes":68719476736,"maxRecords":1000000,"maxBlockBytes":4294967296,"maxHeaderBytes":65536,"maxScratchBytes":4294967296},"corpusFingerprint":"381fdddf5b342f2e7c5c125ace9447413814ab35ceb4da97ba163504f74d256b","scanComplete":true,"resolutionComplete":true,"closureComplete":true,"inputsVerified":true,"complete":true,"files":[{"path":"A.warc","sha256":"b8517cefe711b5d858f9dc70882de1b0405f22ea889de4246709238358f2b39f","recordCount":1,"complete":true},{"path":"B.warc","sha256":"16f1e58cae9a31c1d899ce92027c153252f3478b2f5ebab3e9458cd07c7e0779","recordCount":2,"complete":true},{"path":"C.warc","sha256":"045c02af80af53f52ab93cd6c5280f39b93f9455d92fe1f9f8495e753aecfca1","recordCount":1,"complete":true}],"records":[{"key":{"path":"A.warc","ordinal":1},"type":"revisit","version":"WARC/1.0","rawHeaders":{"Content-Length":["0"],"Content-Type":["application/http; msgtype=response"],"WARC-Block-Digest":["sha1:3I42H3S6NNFQ2MSVX7XZKYAYSCX5QBYJ"],"WARC-Date":["2001-01-01T00:00:00Z"],"WARC-Payload-Digest":["sha1:B6QJ6BNJ3R4B23XXMRKZKHLPGJY2VE4O"],"WARC-Profile":["http://netpreserve.org/warc/1.0/revisit/identical-payload-digest"],"WARC-Record-ID":["<urn:uuid:00000000-0000-4000-8000-000000000201>"],"WARC-Refers-To":["<urn:uuid:00000000-0000-4000-8000-000000000202>"],"WARC-Refers-To-Date":["1999-01-01T00:00:00Z"],"WARC-Refers-To-Target-URI":["http://example.com/b"],"WARC-Target-URI":["http://example.com/a"],"WARC-Type":["revisit"]},"normalizedDigests":{"block":{"algorithm":"sha1","hex":"da39a3ee5e6b4b0d3255bfef95601890afd80709"},"payload":{"algorithm":"sha1","hex":"0fa09f05a9dc781d6ef76455951d6f3271aa938e"}},"payloadEvidence":null,"selector":{"status":"resolved","selectionBasis":"combined","chosen":{"path":"B.warc","ordinal":1},"evidence":{"WARC-Payload-Digest":"sha1:B6QJ6BNJ3R4B23XXMRKZKHLPGJY2VE4O","WARC-Profile":"http://netpreserve.org/warc/1.0/revisit/identical-payload-digest","WARC-Refers-To":"<urn:uuid:00000000-0000-4000-8000-000000000202>","WARC-Refers-To-Date":"1999-01-01T00:00:00Z","WARC-Refers-To-Target-URI":"http://example.com/b"},"candidates":[{"path":"B.warc","ordinal":1}],"findings":[]},"outcome":{"status":"resolved","immediateProvider":{"path":"B.warc","ordinal":1},"selectionBasis":"combined","terminal":{"path":"B.warc","ordinal":1},"payloadEvidence":{"length":9,"hexDigests":{"sha1":"0fa09f05a9dc781d6ef76455951d6f3271aa938e","sha256":"e8e5bf447c352c0080e1444994b0cc1fbe7a25f3ea637c5c89f595b6a95c9253"},"complete":true}},"findings":[]},{"key":{"path":"B.warc","ordinal":1},"type":"response","version":"WARC/1.0","rawHeaders":{"Content-Length":["97"],"Content-Type":["application/http; msgtype=response"],"WARC-Block-Digest":["sha1:OS3OKGCWQIJOAOC3PKXQOQFD52NECQ74"],"WARC-Date":["1999-01-01T00:00:00Z"],"WARC-Payload-Digest":["sha1:B6QJ6BNJ3R4B23XXMRKZKHLPGJY2VE4O"],"WARC-Record-ID":["<urn:uuid:00000000-0000-4000-8000-000000000202>"],"WARC-Target-URI":["http://example.com/b"],"WARC-Type":["response"]},"normalizedDigests":{"block":{"algorithm":"sha1","hex":"74b6e518568212e0385b7aaf0740a3ee9a4143fc"},"payload":{"algorithm":"sha1","hex":"0fa09f05a9dc781d6ef76455951d6f3271aa938e"}},"payloadEvidence":{"length":9,"hexDigests":{"sha1":"0fa09f05a9dc781d6ef76455951d6f3271aa938e","sha256":"e8e5bf447c352c0080e1444994b0cc1fbe7a25f3ea637c5c89f595b6a95c9253"},"complete":true},"selector":null,"outcome":{"status":"resolved","immediateProvider":null,"selectionBasis":"","terminal":{"path":"B.warc","ordinal":1},"payloadEvidence":{"length":9,"hexDigests":{"sha1":"0fa09f05a9dc781d6ef76455951d6f3271aa938e","sha256":"e8e5bf447c352c0080e1444994b0cc1fbe7a25f3ea637c5c89f595b6a95c9253"},"complete":true}},"findings":[]},{"key":{"path":"B.warc","ordinal":2},"type":"revisit","version":"WARC/1.0","rawHeaders":{"Content-Length":["88"],"Content-Type":["application/http; msgtype=response"],"WARC-Block-Digest":["sha1:A6J5UTI2QHHCZFCFNHQHCDD3JJFKP53V"],"WARC-Date":["2002-01-01T00:00:00Z"],"WARC-Payload-Digest":["sha1:B6QJ6BNJ3R4B23XXMRKZKHLPGJY2VE4O"],"WARC-Profile":["http://netpreserve.org/warc/1.0/revisit/identical-payload-digest"],"WARC-Record-ID":["<urn:uuid:00000000-0000-4000-8000-000000000203>"],"WARC-Refers-To":["<urn:uuid:00000000-0000-4000-8000-000000000204>"],"WARC-Refers-To-Date":["1998-01-01T00:00:00Z"],"WARC-Refers-To-Target-URI":["http://example.com/c"],"WARC-Target-URI":["http://example.com/unrelated"],"WARC-Type":["revisit"]},"normalizedDigests":{"block":{"algorithm":"sha1","hex":"0793da4d1a81ce2c944569e0710c7b4a4aa7f775"},"payload":{"algorithm":"sha1","hex":"0fa09f05a9dc781d6ef76455951d6f3271aa938e"}},"payloadEvidence":null,"selector":{"status":"resolved","selectionBasis":"combined","chosen":{"path":"C.warc","ordinal":1},"evidence":{"WARC-Payload-Digest":"sha1:B6QJ6BNJ3R4B23XXMRKZKHLPGJY2VE4O","WARC-Profile":"http://netpreserve.org/warc/1.0/revisit/identical-payload-digest","WARC-Refers-To":"<urn:uuid:00000000-0000-4000-8000-000000000204>","WARC-Refers-To-Date":"1998-01-01T00:00:00Z","WARC-Refers-To-Target-URI":"http://example.com/c"},"candidates":[{"path":"C.warc","ordinal":1}],"findings":[]},"outcome":{"status":"resolved","immediateProvider":{"path":"C.warc","ordinal":1},"selectionBasis":"combined","terminal":{"path":"C.warc","ordinal":1},"payloadEvidence":{"length":9,"hexDigests":{"sha1":"0fa09f05a9dc781d6ef76455951d6f3271aa938e","sha256":"e8e5bf447c352c0080e1444994b0cc1fbe7a25f3ea637c5c89f595b6a95c9253"},"complete":true}},"findings":[]},{"key":{"path":"C.warc","ordinal":1},"type":"response","version":"WARC/1.0","rawHeaders":{"Content-Length":["97"],"Content-Type":["application/http; msgtype=response"],"WARC-Block-Digest":["sha1:OS3OKGCWQIJOAOC3PKXQOQFD52NECQ74"],"WARC-Date":["1998-01-01T00:00:00Z"],"WARC-Payload-Digest":["sha1:B6QJ6BNJ3R4B23XXMRKZKHLPGJY2VE4O"],"WARC-Record-ID":["<urn:uuid:00000000-0000-4000-8000-000000000204>"],"WARC-Target-URI":["http://example.com/c"],"WARC-Type":["response"]},"normalizedDigests":{"block":{"algorithm":"sha1","hex":"74b6e518568212e0385b7aaf0740a3ee9a4143fc"},"payload":{"algorithm":"sha1","hex":"0fa09f05a9dc781d6ef76455951d6f3271aa938e"}},"payloadEvidence":{"length":9,"hexDigests":{"sha1":"0fa09f05a9dc781d6ef76455951d6f3271aa938e","sha256":"e8e5bf447c352c0080e1444994b0cc1fbe7a25f3ea637c5c89f595b6a95c9253"},"complete":true},"selector":null,"outcome":{"status":"resolved","immediateProvider":null,"selectionBasis":"","terminal":{"path":"C.warc","ordinal":1},"payloadEvidence":{"length":9,"hexDigests":{"sha1":"0fa09f05a9dc781d6ef76455951d6f3271aa938e","sha256":"e8e5bf447c352c0080e1444994b0cc1fbe7a25f3ea637c5c89f595b6a95c9253"},"complete":true}},"findings":[]}],"choices":[],"includedFiles":["A.warc","B.warc","C.warc"],"addedFiles":["B.warc","C.warc"],"witnessEdges":[{"consumer":{"path":"A.warc","ordinal":1},"provider":{"path":"B.warc","ordinal":1},"selectionBasis":"combined","terminal":{"path":"B.warc","ordinal":1},"payloadEvidence":{"length":9,"hexDigests":{"sha1":"0fa09f05a9dc781d6ef76455951d6f3271aa938e","sha256":"e8e5bf447c352c0080e1444994b0cc1fbe7a25f3ea637c5c89f595b6a95c9253"},"complete":true}},{"consumer":{"path":"B.warc","ordinal":2},"provider":{"path":"C.warc","ordinal":1},"selectionBasis":"combined","terminal":{"path":"C.warc","ordinal":1},"payloadEvidence":{"length":9,"hexDigests":{"sha1":"0fa09f05a9dc781d6ef76455951d6f3271aa938e","sha256":"e8e5bf447c352c0080e1444994b0cc1fbe7a25f3ea637c5c89f595b6a95c9253"},"complete":true}}],"blockers":[],"findings":[],"warnings":["Completion covers supported local revisit payload dependencies only; it does not establish full WARC conformance, replayability, authenticity or provenance.","Input verification compares each file when observed; it is not an atomic corpus snapshot and later changes are possible.","SHA-1 consistency does not establish collision resistance. Additional SHA-256 evidence does not strengthen a historical SHA-1 declaration.","Relevant raw WARC header values may themselves contain sensitive information. Payload bytes and environment-specific absolute paths are not added to this report.","A complete chosen closure is sufficient for its bindings, not a globally minimum file set."]}
